{
  "$schema": "https://json-schema.org/draft/2020-12/schema",
  "$id": "https://raw.githubusercontent.com/jhyelton/blankie/main/data/series.schema.json",
  "title": "blankie series data",
  "description": "Which Blank Check episodes belong to which miniseries, derived from the Blank Check fan wiki (CC BY-SA). Generated by tools/series-data. Contains no audio, enclosure or Patreon feed URLs.",
  "type": "object",
  "additionalProperties": false,
  "required": ["schemaVersion", "generatedAt", "source", "series", "episodes"],
  "properties": {
    "schemaVersion": {
      "description": "Bumped only for breaking changes.",
      "const": 1
    },
    "generatedAt": {
      "type": "string",
      "format": "date-time",
      "pattern": "^\\d{4}-\\d{2}-\\d{2}T\\d{2}:\\d{2}:\\d{2}Z$"
    },
    "source": {
      "type": "object",
      "additionalProperties": false,
      "required": ["name", "url", "license", "licenseUrl"],
      "properties": {
        "name": { "type": "string", "minLength": 1 },
        "url": { "type": "string", "pattern": "^https://" },
        "license": { "const": "CC BY-SA" },
        "licenseUrl": { "type": "string", "pattern": "^https://" }
      }
    },
    "series": {
      "type": "array",
      "items": { "$ref": "#/$defs/series" }
    },
    "episodes": {
      "type": "object",
      "propertyNames": { "$ref": "#/$defs/episodeId" },
      "additionalProperties": { "$ref": "#/$defs/episode" }
    }
  },
  "$defs": {
    "episodeId": {
      "description": "<air date>:<slug of the normalized wiki title>, fixed when first published.",
      "type": "string",
      "pattern": "^\\d{4}-\\d{2}-\\d{2}:[a-z0-9]+(-[a-z0-9]+)*$"
    },
    "seriesId": {
      "type": "string",
      "pattern": "^[a-z0-9]+(-[a-z0-9]+)*$"
    },
    "series": {
      "type": "object",
      "additionalProperties": false,
      "required": ["id", "title", "subject", "category", "wikiUrl", "episodes"],
      "properties": {
        "id": { "$ref": "#/$defs/seriesId" },
        "title": { "type": "string", "minLength": 1 },
        "subject": { "type": "string" },
        "category": { "enum": ["star-wars", "director", "special-features", "other"] },
        "wikiUrl": { "type": "string", "pattern": "^https://blank-check\\.fandom\\.com/wiki/" },
        "episodes": {
          "description": "Episode IDs in air-date order.",
          "type": "array",
          "uniqueItems": true,
          "items": { "$ref": "#/$defs/episodeId" }
        }
      }
    },
    "episode": {
      "type": "object",
      "additionalProperties": false,
      "required": ["title", "airDate", "feed", "series", "hints"],
      "properties": {
        "title": { "type": "string", "minLength": 1 },
        "airDate": {
          "type": "string",
          "format": "date",
          "pattern": "^\\d{4}-\\d{2}-\\d{2}$"
        },
        "feed": { "enum": ["main", "special-features"] },
        "wikiNumber": { "type": "string", "pattern": "^(SF)?\\d+(\\.\\d+)?$" },
        "series": {
          "type": "array",
          "uniqueItems": true,
          "items": { "$ref": "#/$defs/seriesId" }
        },
        "hints": {
          "type": "object",
          "additionalProperties": false,
          "properties": {
            "publicGuid": { "type": "string", "minLength": 1 },
            "publicTitle": { "type": "string", "minLength": 1 },
            "patreonPostId": { "type": "string", "pattern": "^\\d+$" }
          }
        }
      }
    }
  }
}
