{
  "episodes": {
    "2015-03-23:in-a-galaxy-far-far-away": {
      "airDate": "2015-03-23",
      "feed": "main",
      "hints": {
        "publicGuid": "tag:audioboo.fm,2015-03-23:/boos/3482075",
        "publicTitle": "In A Galaxy Far Far Away… - The Phantom Podcast"
      },
      "series": [
        "the-phantom-podcast"
      ],
      "title": "In A Galaxy Far Far Away",
      "wikiNumber": "1"
    },
    "2015-03-30:the-royalty-of-naboo": {
      "airDate": "2015-03-30",
      "feed": "main",
      "hints": {
        "publicGuid": "tag:audioboo.fm,2015-03-30:/boos/3482069",
        "publicTitle": "The Royalty Of Naboo - The Phantom Podcast"
      },
      "series": [
        "the-phantom-podcast"
      ],
      "title": "The Royalty of Naboo",
      "wikiNumber": "2"
    },
    "2015-04-06:the-jedi-council": {
      "airDate": "2015-04-06",
      "feed": "main",
      "hints": {
        "publicGuid": "tag:audioboo.fm,2015-04-06:/boos/3482066",
        "publicTitle": "The Jedi Council - The Phantom Podcast"
      },
      "series": [
        "the-phantom-podcast"
      ],
      "title": "The Jedi Council",
      "wikiNumber": "3"
    },
    "2015-04-13:commentary": {
      "airDate": "2015-04-13",
      "feed": "main",
      "hints": {
        "publicGuid": "tag:audioboo.fm,2015-04-13:/boos/3482063",
        "publicTitle": "Commentary with Connor Ratliff - The Phantom Podcast"
      },
      "series": [
        "the-phantom-podcast"
      ],
      "title": "Commentary",
      "wikiNumber": "4"
    },
    "2015-04-20:our-performance-review": {
      "airDate": "2015-04-20",
      "feed": "main",
      "hints": {
        "publicGuid": "tag:audioboo.fm,2015-04-20:/boos/3482059",
        "publicTitle": "Our Performance Review - The Phantom Podcast"
      },
      "series": [
        "the-phantom-podcast"
      ],
      "title": "Our Performance Review",
      "wikiNumber": "5"
    },
    "2015-04-28:a-profile-of-jar-jar-binks-and-the-gungans": {
      "airDate": "2015-04-28",
      "feed": "main",
      "hints": {
        "publicGuid": "tag:audioboo.fm,2015-04-28:/boos/3482056",
        "publicTitle": "A Profile Of Jar Jar Binks And The Gungans - The Phantom Podcast"
      },
      "series": [
        "the-phantom-podcast"
      ],
      "title": "A Profile Of Jar Jar Binks And The Gungans",
      "wikiNumber": "6"
    },
    "2015-05-04:the-podrace": {
      "airDate": "2015-05-04",
      "feed": "main",
      "hints": {
        "publicGuid": "tag:audioboo.fm,2015-05-04:/boos/3482051",
        "publicTitle": "The Podrace - The Phantom Podcast"
      },
      "series": [
        "the-phantom-podcast"
      ],
      "title": "The Podrace",
      "wikiNumber": "7"
    },
    "2015-05-11:merchandise": {
      "airDate": "2015-05-11",
      "feed": "main",
      "hints": {
        "publicGuid": "tag:audioboo.fm,2015-05-11:/boos/3482050",
        "publicTitle": "Merchandise - The Phantom Podcast"
      },
      "series": [
        "the-phantom-podcast"
      ],
      "title": "Merchandise",
      "wikiNumber": "8"
    },
    "2015-05-19:fan-fiction": {
      "airDate": "2015-05-19",
      "feed": "main",
      "hints": {
        "publicGuid": "tag:audioboo.fm,2015-05-19:/boos/3482045",
        "publicTitle": "Fan Fiction - The Phantom Podcast"
      },
      "series": [
        "the-phantom-podcast"
      ],
      "title": "Fan Fiction",
      "wikiNumber": "9"
    },
    "2015-05-26:final-thoughts": {
      "airDate": "2015-05-26",
      "feed": "main",
      "hints": {
        "publicGuid": "tag:audioboo.fm,2015-05-26:/boos/3482043",
        "publicTitle": "Final Thoughts - The Phantom Podcast"
      },
      "series": [
        "the-phantom-podcast"
      ],
      "title": "Final Thoughts",
      "wikiNumber": "10"
    },
    "2015-06-01:watch-with-us": {
      "airDate": "2015-06-01",
      "feed": "main",
      "hints": {
        "publicGuid": "tag:audioboo.fm,2015-06-01:/boos/3482042",
        "publicTitle": "Watch With Us - The Phantom Podcast"
      },
      "series": [
        "the-phantom-podcast"
      ],
      "title": "Watch With Us",
      "wikiNumber": "11"
    },
    "2015-09-14:the-podcastic-two": {
      "airDate": "2015-09-14",
      "feed": "main",
      "hints": {
        "publicGuid": "tag:audioboo.fm,2015-09-14:/boos/3572668",
        "publicTitle": "The Podcastic Two"
      },
      "series": [],
      "title": "The Podcastic Two",
      "wikiNumber": "23"
    },
    "2015-09-21:the-beginning-of-the-end": {
      "airDate": "2015-09-21",
      "feed": "main",
      "hints": {
        "publicGuid": "tag:audioboo.fm,2015-09-21:/boos/3601045",
        "publicTitle": "The Beginning of The End - Revenge Of The Podcast"
      },
      "series": [
        "revenge-of-the-podcast"
      ],
      "title": "The Beginning of the End",
      "wikiNumber": "24"
    },
    "2015-09-28:the-downfall-of-anakin-skywalker": {
      "airDate": "2015-09-28",
      "feed": "main",
      "hints": {
        "publicGuid": "tag:audioboo.fm,2015-09-28:/boos/3628123",
        "publicTitle": "The Downfall Of Anakin Skywalker - Revenge Of The Podcast"
      },
      "series": [
        "revenge-of-the-podcast"
      ],
      "title": "The Downfall Of Anakin Skywalker",
      "wikiNumber": "25"
    },
    "2015-10-02:emperor-darth-sidious": {
      "airDate": "2015-10-02",
      "feed": "main",
      "hints": {
        "publicGuid": "tag:audioboo.fm,2015-10-02:/boos/3653934",
        "publicTitle": "Emperor Darth Sidious - Revenge Of The Podcast"
      },
      "series": [
        "revenge-of-the-podcast"
      ],
      "title": "Emperor Darth Sidious",
      "wikiNumber": "26"
    },
    "2015-10-19:the-jedi-order": {
      "airDate": "2015-10-19",
      "feed": "main",
      "hints": {
        "publicGuid": "tag:audioboo.fm,2015-10-19:/boos/3709206",
        "publicTitle": "The Jedi Order with Mike Drucker - Revenge Of The Podcast"
      },
      "series": [
        "revenge-of-the-podcast"
      ],
      "title": "The Jedi Order",
      "wikiNumber": "27"
    },
    "2015-10-23:a-broken-heart": {
      "airDate": "2015-10-23",
      "feed": "main",
      "hints": {
        "publicGuid": "tag:audioboo.fm,2015-10-23:/boos/3735470",
        "publicTitle": "A Broken Heart with Sonia Saraiya - Revenge Of The Podcast"
      },
      "series": [
        "revenge-of-the-podcast"
      ],
      "title": "A Broken Heart",
      "wikiNumber": "28"
    },
    "2015-10-30:our-performance-review-3-0": {
      "airDate": "2015-10-30",
      "feed": "main",
      "hints": {
        "publicGuid": "tag:audioboo.fm,2015-10-30:/boos/3763223",
        "publicTitle": "Our Performance Review 3.0 with Chris Gethard - Revenge Of The Podcast"
      },
      "series": [
        "revenge-of-the-podcast"
      ],
      "title": "Our Performance Review 3.0",
      "wikiNumber": "29"
    },
    "2015-11-06:the-clone-wars-animated-series": {
      "airDate": "2015-11-06",
      "feed": "main",
      "hints": {
        "publicGuid": "tag:audioboo.fm,2015-11-07:/boos/3790985",
        "publicTitle": "The Clone Wars Animated Series with Jonathan Braylock - Revenge Of The Podcast"
      },
      "series": [
        "revenge-of-the-podcast"
      ],
      "title": "The Clone Wars Animated Series",
      "wikiNumber": "30"
    },
    "2015-11-16:more-deleted-scenes": {
      "airDate": "2015-11-16",
      "feed": "main",
      "hints": {
        "publicGuid": "tag:audioboo.fm,2015-11-16:/boos/3818332",
        "publicTitle": "More Deleted Scenes with Mike Ryan - Revenge Of The Podcast"
      },
      "series": [
        "revenge-of-the-podcast"
      ],
      "title": "More Deleted Scenes",
      "wikiNumber": "31"
    },
    "2015-11-23:a-conversation-with-george-lucas": {
      "airDate": "2015-11-23",
      "feed": "main",
      "hints": {
        "publicGuid": "tag:audioboo.fm,2015-11-23:/boos/3845576",
        "publicTitle": "A Conversation with George Lucas - Revenge Of The Podcast"
      },
      "series": [
        "revenge-of-the-podcast"
      ],
      "title": "A Conversation with George Lucas",
      "wikiNumber": "32"
    },
    "2015-11-30:watch-with-us-live-union-hall": {
      "airDate": "2015-11-30",
      "feed": "main",
      "hints": {},
      "series": [
        "revenge-of-the-podcast"
      ],
      "title": "Watch With Us Live @ Union Hall",
      "wikiNumber": "33"
    },
    "2016-10-23:jack-reacher-never-go-back": {
      "airDate": "2016-10-23",
      "feed": "main",
      "hints": {
        "publicGuid": "tag:soundcloud,2010:tracks/289648873",
        "publicTitle": "Jack Reacher: Never Go Back"
      },
      "series": [
        "stealth-mcquarrie-miniseries"
      ],
      "title": "Jack Reacher: Never Go Back",
      "wikiNumber": "80"
    },
    "2016-10-28:true-lies": {
      "airDate": "2016-10-28",
      "feed": "main",
      "hints": {
        "publicGuid": "tag:soundcloud,2010:tracks/290455099",
        "publicTitle": "True Lies"
      },
      "series": [
        "podinator-judgment-cast"
      ],
      "title": "True Lies",
      "wikiNumber": "81"
    },
    "2016-11-03:titanic-part-one": {
      "airDate": "2016-11-03",
      "feed": "main",
      "hints": {
        "publicGuid": "tag:soundcloud,2010:tracks/291384687",
        "publicTitle": "Titanic with Emily Yoshida and Katey Rich - Part One"
      },
      "series": [
        "podinator-judgment-cast"
      ],
      "title": "Titanic - Part One",
      "wikiNumber": "82"
    },
    "2016-11-11:titanic-part-two": {
      "airDate": "2016-11-11",
      "feed": "main",
      "hints": {},
      "series": [
        "podinator-judgment-cast"
      ],
      "title": "Titanic - Part Two",
      "wikiNumber": "83"
    },
    "2016-11-18:aliens-of-the-deep-ghosts-of-the-abyss": {
      "airDate": "2016-11-18",
      "feed": "main",
      "hints": {
        "publicGuid": "tag:soundcloud,2010:tracks/293709118",